{"evidence":[],"execution_plan":null,"findings":[],"milestones":[{"acceptance":"C01 \u306E\u5168\u898F\u7BC4\u9805\u76EE\u306B\u62C5\u5F53task\u3068\u691C\u8A3C\u6BB5\u968E\u304C\u4ED8\u304D\u3001\u5B57\u53E5/\u69CB\u6587\u30FBsource identity\u30FB\u6761\u4EF6\u9078\u629E\u306E\u6B63\u8CA0\u4F8B\u3068\u5F80\u5FA9\u691C\u8A3C\u304C\u6210\u529F\u3059\u308B\u3002doc\u53C2\u7167\u5148\u306E\u9664\u5916\u3068\u672C\u6587\u6C7A\u5B9A\u4E8B\u9805\u306E\u4FDD\u6301\u3092\u78BA\u8A8D\u3067\u304D\u308B\u3002","description":"\u4ED5\u69D8\u7DB2\u7F85\u8868\u3068source/\u69CB\u6587\u30FB\u6761\u4EF6\u9078\u629E\u306E\u57FA\u76E4","id":"M01","task_ids":["T01","T02","T03"]},{"acceptance":"Type/length/Origin schema\u3001\u30A2\u30AF\u30BB\u30B9\u30FBfragment\u3001\u8A3C\u660E/witness\u3001\u5019\u88DC\u9078\u629E\u3068closed specialization set\u306E\u610F\u5473\u30C6\u30B9\u30C8\u304C\u6210\u529F\u3059\u308B\u3002\u672A\u89E3\u6C7A\u7FA9\u52D9\u306E\u4FDD\u5B58/\u671F\u9650\u3068cache\u5931\u52B9\u3092\u78BA\u8A8D\u3067\u304D\u308B\u3002","description":"\u5B8C\u5168Type\u30FB\u540D\u524D\u89E3\u6C7A\u30FBContract\u30FBgeneric\u9078\u629E","id":"M02","task_ids":["T04","T05","T06","T07"]},{"acceptance":"\u95A2\u6570/default/receiver\u3001Property/constructor\u3001scalar/\u578B\u9069\u5FDC/\u4EE3\u5165\u306E\u9078\u629E\u7D50\u679C\u306B\u578B\u30FB\u8A55\u4FA1\u9806\u30FB\u53D6\u5F97\u30FB\u8A3A\u65AD\u306E\u6839\u62E0\u304C\u3042\u308A\u3001\u6B63\u8CA0\u4F8B\u304C\u671F\u5F85\u3069\u304A\u308A\u306B\u306A\u308B\u3002","description":"\u95A2\u6570\u30FBProperty\u30FBconstructor\u30FB\u6F14\u7B97\u306E\u610F\u5473\u8A08\u753B","id":"M03","task_ids":["T08","T09","T10"]},{"acceptance":"\u90E8\u5206Move\u3001\u4FDD\u5B58/\u8FD4\u5374/reborrow\u3001deinit/defer\u3001callable\u52B9\u679C\u3001Pattern/refinement/require\u306E\u5FC5\u9808\u691C\u8A3C\u304C\u6210\u529F\u3057\u3001\u7FA9\u52D9\u3092\u89E3\u6D88\u3057\u305F\u8A08\u753B\u3060\u3051\u3092lowering\u3078\u6E21\u305B\u308B\u3002","description":"\u4E00\u822C\u6240\u6709\u6A29\u30FBLoan\u30FB\u52B9\u679C\u30FB\u5236\u5FA1\u30D5\u30ED\u30FC","id":"M04","task_ids":["T11","T12","T13","T14","T15"]},{"acceptance":"\u5168\u5FC5\u9808Core\u306Eidentity/shape\u304C\u63C3\u3044\u3001\u914D\u5217/Slice/Dictionary/\u53CD\u5FA9/\u88DC\u9593\u3001object/Weak\u306E\u64CD\u4F5C\u8A08\u753B\u3068\u5BFF\u547D/\u5931\u6557\u5951\u7D04\u306E\u6B63\u8CA0\u4F8B\u304C\u6210\u529F\u3059\u308B\u3002\u672C\u6587\u306Epublic API\u306B\u672A\u5BFE\u5FDC\u67A0\u304C\u306A\u3044\u3002","description":"sequence\u30FBcollection\u30FBobject\u30FBCore\u306E\u5951\u7D04","id":"M05","task_ids":["T16","T17","T18","T19","T20"]},{"acceptance":"\u76F4\u63A5\u4F9D\u5B58\u306E\u540D\u524D\u5883\u754C\u3068\u610F\u5473\u60C5\u5831\u4FDD\u6301/\u5931\u52B9\u3092\u518D\u69CB\u7BC9\u8A66\u9A13\u3067\u78BA\u8A8D\u3067\u304D\u308B\u3002Mod graph\u3001\u4E00\u56DE\u5B9F\u884C\u3001query/append/Binding\u5883\u754C\u3001\u518D\u751F\u6210/\u5931\u6557/\u53D6\u6D88/\u8A3A\u65AD\u30FB\u8868\u793A\u4FDD\u5B58\u306E\u7D71\u5408\u691C\u8A3C\u304C\u6210\u529F\u3059\u308B\u3002","description":"module/source\u518D\u5229\u7528\u3068Mod\u30D1\u30A4\u30D7\u30E9\u30A4\u30F3","id":"M06","task_ids":["T21","T22"]},{"acceptance":"\u5168\u5BFE\u8C61layout\u3068\u8CAC\u4EFB\u4ED8\u304DABI/CFG\u3001\u5171\u6709generic/entry/context/\u56FA\u5B9Aframe\u3092\u691C\u67FB\u6E08\u307F\u8A08\u753B\u304B\u3089\u751F\u6210\u3067\u304D\u308B\u3002C\u6BD4\u8F03\u3001IR\u691C\u67FB\u3001\u5FC5\u9808\u7279\u6B8A\u5316\u30FB\u4E88\u7B97/\u9806\u5E8F\u4E0D\u5909\u30FBlimit\u62D2\u5426\u306E\u691C\u8A3C\u304C\u6210\u529F\u3059\u308B\u3002","description":"layout\u30FB\u4E00\u822CABI\u30FBgeneric generation","id":"M07","task_ids":["T23","T24","T25"]},{"acceptance":"\u5404\u5206\u91CE\u306Esource\u64CD\u4F5C\u304C\u901A\u5E38native\u3067\u5B9F\u884C\u3067\u304D\u3001O0/O2\u306E\u7D50\u679C\u30FB\u526F\u4F5C\u7528/\u7834\u68C4\u9806\u304C\u4E00\u81F4\u3059\u308B\u3002Weak/arc\u306E\u898F\u5B9A\u9806\u5E8F\u306E\u6839\u62E0\u3068\u3001\u7981\u6B62\u30FB\u672A\u5230\u9054/\u672A\u4F7F\u7528\u64CD\u4F5C\u306E\u6700\u9069\u5316\u524D\u8A3A\u65AD\u3092\u78BA\u8A8D\u3067\u304D\u308B\u3002","description":"callable/object\u30FBaggregate/collection\u30FBscalar\u5B9F\u884C","id":"M08","task_ids":["T26","T27","T28"]},{"acceptance":"\u8A31\u53EFC ABI\u3068pointer\u5883\u754C\u3001static\u521D\u671F\u5316/\u7D42\u4E86\u30FB\u6545\u969C\u6CE8\u5165\u304C\u6210\u529F\u3059\u308B\u3002Hello\u306E14 byte\u51FA\u529B\u30FB\u7A7Astderr\u30FBexit 0\u3001Abort exit 1\u3068cleanup\u3057\u306A\u3044\u6319\u52D5\u3092\u5B9F\u30A2\u30D7\u30EA\u3067\u78BA\u8A8D\u3067\u304D\u308B\u3002","description":"FFI\u30FBstartup\u30FBstatic\u30FBruntime","id":"M09","task_ids":["T29","T30"]},{"acceptance":"Library\u306Epre-opt IR/object\u691C\u8A3C\u3068Application emit/build/run\u3001\u516C\u958B\u5931\u6557/\u65E7\u6210\u529F\u7121\u52B9\u5316\u3001backend/kernel32\u306E\u5B9Fhash/\u7248\u30FBCOFF/unwind/\u4F9D\u5B58\u691C\u8A3C\u304C\u6210\u529F\u3059\u308B\u3002NativeAOT\u306F\u7528\u3044\u306A\u3044\u3002","description":"Library/CLI\u6210\u679C\u7269\u3068native\u4F9B\u7D66","id":"M10","task_ids":["T31","T32"]},{"acceptance":"C01\u2013C16\u3092\u3059\u3079\u3066\u6E80\u305F\u3059\u3002Debug/Release managed\u3068\u5FC5\u8981\u306AO0/O2 native\u691C\u8A3C\u304C\u6709\u52B9\u306A\u73FE\u5165\u529B\u306B\u5BFE\u5FDC\u3057\u3001\u5FC5\u9808\u306E\u672A\u5B9F\u88C5/\u672A\u691C\u8A3C/skip\u30FB\u6F0F\u308C\u304C0\u4EF6\u3002SPEC/STATUS\u3068\u5168\u5BFE\u5FDC\u8868\u304C\u30B3\u30FC\u30C9\u30FB\u8A3C\u62E0\u3068\u4E00\u81F4\u3059\u308B\u3002","description":"\u5168\u5FC5\u9808\u691C\u8A3C\u30FB\u6027\u80FD\u78BA\u8A8D\u30FB\u6587\u66F8\u6574\u5408","id":"M11","task_ids":["T33","T34","T35"]}],"schema_version":1,"tasks":[{"acceptance":"\u5168\u898B\u51FA\u3057\u914D\u4E0B\u306E\u5FC5\u9808\u898F\u5247\u30FB\u7981\u6B62\u30FB\u691C\u8A3C\u8868\u306B\u62C5\u5F53\u304C\u3042\u308A\u3001\u672A\u78BA\u5B9A/\u975E\u898F\u7BC4/\u5BFE\u8C61\u5916\u306F\u62C5\u5F53\u7BC0\u306B\u3088\u308B\u6839\u62E0\u304C\u3042\u308B\u3002\u5B9F\u88C5\u6E08\u307F\u3082\u691C\u8A3C\u5BFE\u8C61\u306B\u6B8B\u3059\u3002","blocker":null,"criterion_ids":["C01","C16"],"deliverables":[],"depends_on":[],"description":"\u00A71\u201322\u30FB\u4ED8\u9332A/F\u306E\u5168\u898F\u7BC4\u9805\u76EE\u3092\u68DA\u5378\u3057\u3057\u3001STATUS.md \u3068\u73FE\u30B3\u30FC\u30C9\u306E\u6BB5\u968E\u5225\u5DEE\u5206\u3001\u62C5\u5F53 task\u3001\u671F\u5F85\u7D50\u679C\u3092\u5BFE\u5FDC\u4ED8\u3051\u308B\u3002\u4ED8\u9332B/C/D/E\u3068 doc \u53C2\u7167\u5883\u754C\u3082\u5206\u985E\u3059\u308B\u3002","evidence_refs":[],"id":"T01","remaining":[],"replacements":[],"required":true,"source_ids":["T01"],"status":"pending","verification":"\u6587\u66F8\u3068\u30B3\u30FC\u30C9/\u65E2\u5B58\u30C6\u30B9\u30C8\u306E\u9759\u7684\u7167\u5408\u3002\u5BFE\u5FDC\u8868\u306F STATUS.md \u307E\u305F\u306F\u5B9F\u884C\u8A18\u9332\u306B\u4FDD\u5B58\u3057\u3001\u4EE5\u5F8C\u306E\u5206\u5272\u3067\u3082\u5143 task \u3068\u5FC5\u9808\u6027\u3092\u7DAD\u6301\u3059\u308B\u3002C01 \u306E\u6F0F\u308C\u691C\u67FB\u3092\u884C\u3046\u3002"},{"acceptance":"Unicode 15.0/NFC\u3001UTF-8\u3001\u4E0D\u6B63\u6587\u5B57/escape\u3001indent/\u7D99\u7D9A\u3001\u5B8C\u5168Type/Origin/\u5BA3\u8A00/\u5F0F\u306E\u78BA\u5B9A\u69CB\u6587\u3068\u56DE\u5FA9\u3092\u5B9F\u88C5\u3057\u3001\u5143source\u3068exact literal\u3092\u4FDD\u6301\u3059\u308B\u3002","blocker":null,"criterion_ids":["C02"],"deliverables":[],"depends_on":["T01"],"description":"\u00A72\u30FBA.1/A.6\u30FBF.1\u2013F.9\u306E\u5B57\u53E5/\u69CB\u6587\u3001source snapshot\u3001\u8A3A\u65AD\u4F4D\u7F6E\u3001writer/serialization \u3092\u4ED5\u4E0A\u3052\u308B\u3002","evidence_refs":[],"id":"T02","remaining":[],"replacements":[],"required":true,"source_ids":["T02"],"status":"pending","verification":"UnicodeIdentifier/SourceEncoding/SourceDocumentAndDiagnostic\u3001NumberLiteral/CharLiteral/StringLiteral\u3001FrontEndSyntax/ParserRegression/PropertyRevision/NestedType/KotonohaSerialization \u3092\u57FA\u306B\u6B63\u8CA0\u4F8B\u3068\u5F80\u5FA9\u691C\u8A3C\u3092\u88DC\u5B8C\u3059\u308B\u3002"},{"acceptance":"case-sensitive \u306E\u8A2D\u5B9A/\u7D44\u8FBC\u307F\u540D\u3001\u578B\u30FB\u91CD\u8907\u30FBNFC\u3001\u5168 reached \u6761\u4EF6\u306E\u8A3A\u65AD\u3001false #if \u3068\u975E\u9078\u629E case \u306E\u7570\u306A\u308B\u691C\u67FB\u5883\u754C\u3001\u9078\u629E\u9805\u76EE\u306E\u540C\u4E00scope\u3092\u6E80\u305F\u3059\u3002","blocker":null,"criterion_ids":["C02","C10"],"deliverables":[],"depends_on":["T02"],"description":"\u00A719\u30FB\u00A720.3\u20136\u30FBA.2 \u306E target \u6E96\u5099\u3001\u74B0\u5883\u6761\u4EF6\u3068\u5373\u6642 #if/#switch \u9078\u629E\u3092\u5B8C\u6210\u3059\u308B\u3002","evidence_refs":[],"id":"T03","remaining":[],"replacements":[],"required":true,"source_ids":["T03"],"status":"pending","verification":"CompilationSpecification/DirectiveConditionValidation/CompileTimeSwitch \u3092\u62E1\u5F35\u3057\u3001\u77ED\u7D61\u30FB\u975E\u9078\u629E\u30FB\u5165\u308C\u5B50\u30FB\u8A3A\u65AD\u4F4D\u7F6E\u30FBalias/defer/transfer \u306E\u5883\u754C\u3068 eager/cache \u7D50\u679C\u4E00\u81F4\u3092\u78BA\u8A8D\u3059\u308B\u3002"},{"acceptance":"nested Semantics\u3001Core/\u5B8C\u5168Type slot\u3001Origin bound/variance\u3001\u95A2\u6570/\u914D\u5217/Weak \u3092\u8868\u73FE\u3057\u3001length \u306E\u6B63\u898F\u5316\u30FB\u8CA0\u6570/overflow\u30FBrecursive layout \u7FA9\u52D9\u3092\u4FDD\u6301\u3059\u308B\u3002","blocker":null,"criterion_ids":["C03","C08"],"deliverables":[],"depends_on":["T02","T03"],"description":"\u00A73\u30FB\u00A74.1\u20134.4\u30FB\u00A78.1\u30FB\u00A715.2\u20134\u30FBA.12 \u306E\u5B8C\u5168 Type\u3001generic pair/length/Origin schema\u3001\u5B9A\u6570\u53C2\u7167\u30FBlength \u63A8\u8AD6\u3092\u5B8C\u6210\u3059\u308B\u3002","evidence_refs":[],"id":"T04","remaining":[],"replacements":[],"required":true,"source_ids":